{
    "$schema": "https://json-schema.org/draft/2020-12/schema",
    "$id": "https://muntashirakon.github.io/android-debloat-list/bloatware_list.json",
    "title": "Bloatware List",
    "description": "Listing of Android bloatware",
    "type": "array",
    "items": {
        "type": "object",
        "properties": {
            "id": {
                "description": "Bloatware package name",
                "type": "string"
            },
            "label": {
                "description": "Bloatware package label",
                "type": "string"
            },
            "dependencies": {
                "description": "Packages that this bloatware depends on",
                "type": "array",
                "items": {
                    "type": "string"
                },
                "minItems": 1,
                "uniqueItems": true
            },
            "required_by": {
                "description": "Packages that depend on this bloatware",
                "type": "array",
                "items": {
                    "type": "string"
                },
                "minItems": 1,
                "uniqueItems": true
            },
            "tags": {
                "description": "Predefined tags",
                "type": "array",
                "items": {
                    "type": "string"
                },
                "minItems": 1,
                "uniqueItems": true
            },
            "description": {
                "description": "Bloatware description",
                "type": "string"
            },
            "web": {
                "description": "Online references",
                "type": "array",
                "items": {
                    "type": "string"
                },
                "minItems": 1,
                "uniqueItems": true
            },
            "removal": {
                "description": "Bloatware removal type (delete, replace, caution, unsafe)",
                "type": "string",
                "enum": [
                    "delete",
                    "replace",
                    "caution",
                    "unsafe"
                ]
            },
            "warning": {
                "description": "Possible consequences of removing the bloatware (for caution and unsafe), for others, useful information",
                "type": "string"
            },
            "suggestions": {
                "description": "Suggestion ID for listing alternatives to this bloatware",
                "type": "string"
            },
            "suppress": {
                "description": "Suppress a particular warning issued by the linter, separated by comma without space",
                "type": "string"
            }
        },
        "required": [
            "id",
            "description",
            "removal"
        ]
    },
    "uniqueItems": true
}
